<?xml version="1.0" encoding="UTF-8"?>
<!DOCTYPE cadastroteste SYSTEM "cadastroteste.dtd" >
<cadastroteste>
		<contato>
		<nome>nome</nome>
		<telefone ddd="nmtoken">telefone</telefone>
		<departamento>departamento</departamento>
		<empresa>empresa</empresa>
	</contato>
		<contato>
			<nome>nome</nome>
			<telefone ddd="nmtoken" ramal="11">telefone</telefone>
			<departamento>departamento</departamento>
			<empresa>empresa</empresa>
		</contato>
		<contato>
			<nome>nome</nome>
			<telefone ddd="nmtoken" ramal="12">telefone</telefone>
			<departamento>departamento</departamento>
			<empresa>empresa</empresa>
		</contato>
</cadastroteste>